{
  "eventId": "b4a2d3e5-6f70-4b8c-9d0e-1f2a3b4c5d6e",
  "eventType": "reporte.validado",
  "version": 1,
  "occurredAt": "2026-09-26T15:12:00Z",
  "correlationId": "1b2c3d4e-5f60-4718-9293-a4b5c6d7e8f9",
  "reportId": "9f8e7d6c-5b4a-4321-9876-1a2b3c4d5e6f",
  "data": {
    "actorId": "33333333-3333-4333-8333-333333333333",
    "municipioId": "22222222-2222-4222-8222-222222222222",
    "estadoPrevio": "RECIBIDO",
    "estadoNuevo": "VALIDADO",
    "motivo": "Confirmado por inspección en campo"
  }
}
