{
  "eventId": "a3f1c2d4-5e6f-4a7b-8c9d-0e1f2a3b4c5d",
  "eventType": "reporte.creado",
  "version": 1,
  "occurredAt": "2026-09-26T14:03:00Z",
  "correlationId": "1b2c3d4e-5f60-4718-9293-a4b5c6d7e8f9",
  "reportId": "9f8e7d6c-5b4a-4321-9876-1a2b3c4d5e6f",
  "data": {
    "actorId": "11111111-1111-4111-8111-111111111111",
    "municipioId": "22222222-2222-4222-8222-222222222222",
    "categoria": "hueco_via",
    "lat": 4.65,
    "lon": -74.05
  }
}
