{
  "eventId": "c5b3e4f6-7081-4c9d-0e1f-2a3b4c5d6e7f",
  "eventType": "obra.asignada",
  "version": 1,
  "occurredAt": "2026-09-26T15:20:00Z",
  "correlationId": "1b2c3d4e-5f60-4718-9293-a4b5c6d7e8f9",
  "reportId": "9f8e7d6c-5b4a-4321-9876-1a2b3c4d5e6f",
  "data": {
    "obraId": "44444444-4444-4444-8444-444444444444",
    "actorId": "33333333-3333-4333-8333-333333333333",
    "entidadResponsable": "Secretaría de Infraestructura",
    "presupuestoAsignado": 3500000
  }
}
