{
  "eventId": "dddddddd-dddd-4ddd-8ddd-dddddddddddd",
  "eventType": "reporte.resuelto",
  "version": 1,
  "occurredAt": "2026-09-30T13:00:00Z",
  "correlationId": "bbbbbbbb-bbbb-4bbb-8bbb-bbbbbbbbbbbb",
  "reportId": "cccccccc-cccc-4ccc-8ccc-cccccccccccc",
  "data": {
    "actorId": "11111111-1111-4111-8111-111111111111",
    "municipioId": "22222222-2222-4222-8222-222222222222",
    "estadoPrevio": "EN_OBRA",
    "estadoNuevo": "RESUELTO",
    "motivo": "Intervención terminada y verificada en sitio."
  }
}
