{
  "eventId": "aaaaaaaa-aaaa-4aaa-8aaa-aaaaaaaaaaaa",
  "eventType": "reporte.rechazado",
  "version": 1,
  "occurredAt": "2026-09-30T12:00:00Z",
  "correlationId": "bbbbbbbb-bbbb-4bbb-8bbb-bbbbbbbbbbbb",
  "reportId": "cccccccc-cccc-4ccc-8ccc-cccccccccccc",
  "data": {
    "actorId": "11111111-1111-4111-8111-111111111111",
    "municipioId": "22222222-2222-4222-8222-222222222222",
    "estadoPrevio": "RECIBIDO",
    "estadoNuevo": "RECHAZADO",
    "motivo": "No corresponde a una afectación de infraestructura pública."
  }
}
